subreddit,title,author,score,upvote_ratio,num_comments,created_utc,url,selftext,link_flair_text,post_id,top_comments,comment_multiplier,adjusted_comment_weight,base_score,engagement_ratio,hours_old,time_bonus,popularity_score,category,classification_confidence
movies,New Images from 'Coyote vs. Acme',MarvelsGrantMan136,18312,0.95,633,2025-07-26 16:22:56,https://i.redd.it/b8qj04igv8ff1.jpeg,,Media,1m9xi0s,[],1.8,9.0,24009.0,0.0345656091301261,6.835796281111112,0.9858596845623404,23669.50516665723,News & Announcements,low_opinion
movies,Official Poster for 'Coyote vs. Acme',MarvelsGrantMan136,5584,0.97,127,2025-07-26 18:10:22,https://i.redd.it/8mi5axgme9ff1.jpeg,,Poster,1ma051y,[],1.8,9.0,6727.0,0.0227394807520143,5.045240725555556,0.9895441284897468,6656.663352350528,News & Announcements,medium
movies,What are some of the worst/most obvious product placements in movies?,cubansbottomdollar,516,0.92,604,2025-07-26 16:29:53,https://www.reddit.com/r/movies/comments/1m9xo2a/what_are_some_of_the_worstmost_obvious_product/,"The Secret Life of Walter Mitty opens with the main protagonist (played by Ben Stiller) using E-Harmony, and a scene later, he's on the phone with a company rep (played by Patton Oswald) who says a line about E-Harmony mentioning their ""matching algorithm"" making them different than other dating sites, where Stiller's character replies ""Yeah, that's what I like about you guys.""

The movie also says the company name ""Papa John's"" no less than 7 or so times.

And at the end, when Adam Scott's character is asked what Life's motto is, he replies, ""Life... I'm lovin' it?"" to which Stiller's says ""That's McDonald's.""

What other examples of obvious, shameless, eye-roll inducing product placements in movies can you think of?",Discussion,1m9xo2a,[],1.8,9.0,5952.0,1.1682785299806575,6.719962947777778,0.9860976203818343,6464.4530365126775,Reviews & Discussions,high
television,"Who is the most unredeemable, purely evil villain you've seen in a TV show?",Top_Report_4895,320,0.84,641,2025-07-26 01:47:01,https://www.reddit.com/r/television/comments/1m9h72l/who_is_the_most_unredeemable_purely_evil_villain/,My choices are Joe Goldberg from You. Should've eaten sidewalk.,,1m9h72l,[],1.8,9.0,6089.0,1.9968847352024923,21.434407392222223,0.956327343136792,6431.9771923599255,News & Announcements,low_opinion
letterboxd,"6 years ago today, Quentin Tarantino’s 'ONCE UPON A TIME IN HOLLYWOOD' was released in theatres.",Wooden-District5456,2850,0.94,268,2025-07-26 04:55:35,https://i.redd.it/ypbm8tqtg5ff1.jpeg,"
What's your opinion on this film?",Discussion,1m9kr4b,[],1.8,9.0,5262.0,0.0940021045247281,18.29162961444444,0.962609395422648,5065.250638713975,Reviews & Discussions,high
movies,"'Coyote vs. Acme' Sets August 28, 2026 Theatrical Release",MarvelsGrantMan136,3643,0.97,146,2025-07-26 17:17:58,https://deadline.com/2025/07/coyote-vs-acme-comic-con-1236469435/,,News,1m9yv72,[],1.8,9.0,4957.0,0.04006586169045,5.91857405888889,0.9877453448123392,4896.253674234765,News & Announcements,high
anime,The quality of subs is decreasing a LOT lately. And it's not only cruncyroll.,Iroiroanswer,1759,0.92,369,2025-07-26 17:14:50,https://www.reddit.com/r/anime/comments/1m9ysco/the_quality_of_subs_is_decreasing_a_lot_lately/,"I'm watching anime from different sources and there's a LOT of anime that are badly subbed now. Even the ""groups"" that isn't a big corporations.

It's funny because Muse Asia or Ani-One subs are mediocre but with the bad subs around lately they have more accurate subs.

Recent ones I've watched are Bad Girl, Kaoru Hana, and Busu ni Hanataba wo. Kaoru Hana being the worst offender(literally ChatGPT levels of subs) and Bad Girl changing ""polyethylene"" to ""Police"". Yes, I know that CrunchyRoll has them too but these subs came from somewhere else, even ""groups"" that were reliable before.",Discussion,1m9ysco,[],1.0,5.0,3604.0,0.2096590909090909,5.970796281111111,0.9876378876227178,3919.8469469922743,Reviews & Discussions,high
television,King of the Hill showrunner discusses diversifying reboot cast: 'The world has changed',bwermer,977,0.83,235,2025-07-26 09:19:33,https://ew.com/king-of-the-hill-showrunner-discusses-diversifying-reboot-cast-11779234,,,1m9oymi,[],1.8,9.0,3092.0,0.2402862985685071,13.89218517,0.971472757313894,3312.9937656145603,News & Announcements,low_opinion
horror,"in your opinion, what is the best horror movie of all time ?",hermeslayer,70,0.79,257,2025-07-26 21:36:48,https://www.reddit.com/r/horror/comments/1ma5192/in_your_opinion_what_is_the_best_horror_movie_of/,"What the title says. I think the best horror movie I’ve seen so far, in terms of narration, actors, soundtracks attention to details and fear, is The Exorcist (1973). Basic, I know, but I’ve seen it lately for the first time and I was shocked by how horrifying it was, still, after more than 50 years of existence. 

I’m trying to dive deep into the genre, so if feel free to share your magnum opus of horror ! It can be totally subjective. ",,1ma5192,[],1.5,7.5,1997.5,3.619718309859155,1.60468517,0.996662487812904,2190.583319406276,Recommendation Requests,medium
televisionsuggestions,Suggest me a tv show,SwingFIow,191,0.92,456,2025-07-26 13:21:12,https://i.redd.it/seu3w181z7ff1.jpeg,"Can you suggest me a tv show based on my list? Also tried Twin Peaks, Mad man but didnt enjoy it. Thanks",,1m9t7in,[],0.8,4.0,2015.0,2.375,9.86468517,0.9796583138622972,2175.5115024325287,Recommendation Requests,high
letterboxd,The most disturbing films I've seen ranked.,Qazified,258,0.93,182,2025-07-26 19:54:47,https://www.reddit.com/gallery/1ma2net,"Made this list a while back. What quintessential ""disturbing"" films am I missing? What in your opinion is the most disturbing film from this list?",Discussion,1ma2net,[],1.8,9.0,1896.0,0.7027027027027027,3.3049629477777778,0.993138310165573,2072.5902360739265,Reviews & Discussions,high
television,Dexter: Resurrection is so incredibly dumb - but Michael C Hall's phenomenal performance still makes it a lot of fun,AngryGardenGnomes,240,0.69,186,2025-07-26 12:47:21,https://www.reddit.com/r/television/comments/1m9shmt/dexter_resurrection_is_so_incredibly_dumb_but/,"Warning: Contains spoilers.

So maybe it's because I'm older but I don't recall the show being this dumb and full of plot holes. I think it's a byproduct of Dexter no longer being a part of a police department, and having far less access to personal data and crime scenes.

I still find the show very enjoyable, if tired, but some of the elements in the show have really stuck out to me as incredibly stupid.

Saying this, I really enjoy Michael C Hall's phenomenal performance. That's what's kept me sticking around. I'm really glad they brought the dad back as Dexter's dark passenger. Their chemistry has always been off the charts. Harrison's scenes...I have to admit, I skip through most of them.

- Harrison killing a dude and chopping up the body with free reign over the clearly very high class hotel. No cameras in the hallways - they address this later but still - and no one in or out of the kitchens throughout the whole night and morning. 

- Dexter waking up in hospital and being compl",,1m9shmt,[],1.8,9.0,1914.0,0.7717842323651453,10.428851836666666,0.9785075515894684,2064.2634537422427,News & Announcements,low_opinion
netflix,Binge-worthy limited series?,StreetFriendship1200,98,0.9,258,2025-07-26 20:28:06,https://www.reddit.com/r/netflix/comments/1ma3fls/bingeworthy_limited_series/,"It’s Saturday afternoon. Hubby and I were planning to host some friends for cocktails and a lovely dinner, but they just called to cancel the last minute because they are sick and don’t wanna make us ill. So we have the night to ourselves, for date night. And some amazing cocktails, appetizers and a grilled porkchop dinner ahead of us. Don’t feel like inviting anyone else, so I’m currently searching for a good Netflix movie or limited series to watch tonight. Something good, like a thriller or action pack. Any suggestions welcome! I’m running out of patience scrolling aimlessly on damn Netflix and reading reviews 🙄",What Should I Watch?,1ma3fls,[],1.2,6.0,1646.0,2.606060606060606,2.74968517,0.9942878658608332,1801.1978272069314,Recommendation Requests,medium
criterion,Favorite Kurosawa movie?,Ok-Result-2330,248,0.98,109,2025-07-26 19:20:26,https://i.redd.it/6zhmgycwq9ff1.jpeg,"I love his samurai movies but I gotta say High & Low really blew me away, so ahead of its time, the storytelling felt really modern to me. Really love this one! ",Discussion,1ma1u8j,[],2.0,10.0,1338.0,0.4377510040160642,3.8774629477777776,0.991954491942153,1461.0351102186007,Lists & Rankings,high
MovieSuggestions,Movie where killler never getting caught at the end of the movie,pratik1698,93,0.96,314,2025-07-26 14:59:19,https://www.reddit.com/r/MovieSuggestions/comments/1m9vfsc/movie_where_killler_never_getting_caught_at_the/,"Suggest me a movie where killer didnt get caught at the end something like zodiac, memories of murder , drishyam , 3 billboards , the open house , Treatment etc etc",I'M REQUESTING,1m9vfsc,[],0.8,4.0,1349.0,3.3404255319148937,8.229407392222223,0.9830015335806505,1460.9690688002977,Recommendation Requests,high
horror,Rotten Tomatoes’s “200 Best Horror Movies of All Time” list – have you seen them all?,Lucky_Election_9267,83,0.8,154,2025-07-26 22:47:54,https://www.reddit.com/r/horror/comments/1ma6mwa/rotten_tomatoess_200_best_horror_movies_of_all/,"I am going down the list of the 200 best horror movies of all time according to RT, and was wondering:
	•	How many of the 200 have you actually seen?
	•	Any major surprises on the list? Unexpected picks or glaring omissions?
	•	Which films on that roster are you most ashamed to haven’t watched yet?

Link to full list: https://editorial.rottentomatoes.com/guide/best-horror-movies-of-all-time/",Discussion,1ma6mwa,[],1.5,7.5,1238.0,1.8333333333333333,0.41968517,0.9991260380232612,1360.7180350727972,Reviews & Discussions,high
letterboxd,'Her' voted the best movie of 2013. What is the best movie of 2012?,keepfighting90,127,0.81,112,2025-07-26 21:22:56,https://i.redd.it/jq7qhl1icaff1.png,"[2013](https://www.reddit.com/r/Letterboxd/comments/1m91wnw/whiplash_voted_the_best_movie_of_2014_what_is_the/)

This is the closest I've ever seen one of these polls for the top 2 movies. As of the time of this post, Her is leading Prisoners by *2* measly votes, and both movies have pretty much been flip-flopping in the lead for most of the day. 

This could change post-submission, but unfortunately them's the breaks and I have to go with what the results are right now. I already waited to post longer than I usually do because I was out of town most of the day, so it worked out to let more people vote. Either movie would've been a well-deserved win but Her takes it in the end.

Now onto 2012...I have a feeling this is an easy win for Django. My personal pick, however, is the harrowing, poignant **The Hunt.**",Letterboxd,1ma4pr4,[],1.8,9.0,1135.0,0.875,1.835796281111111,0.9961827287885462,1244.167397175,Reviews & Discussions,low
televisionsuggestions,TV shows with best soundtracks?,urfunnyboi,41,0.98,196,2025-07-26 03:25:25,https://www.reddit.com/r/televisionsuggestions/comments/1m9j3g9/tv_shows_with_best_soundtracks/,I need a tv show from any genre but it must have a good storyline and an amazing soundtrack.,,1m9j3g9,[],0.8,4.0,825.0,4.666666666666667,19.794407392222222,0.9596003831518526,874.1703161002783,Recommendation Requests,high
horror,Trying to beat depression by watching films about people way worse off than I am.,NicVet2b,40,0.81,99,2025-07-26 09:00:40,https://www.reddit.com/r/horror/comments/1m9oob1/trying_to_beat_depression_by_watching_films_about/,"Well here goes nothing with my first post here. I am a HUGE horror fan, and my favorite genres are probably sci-fi, paranormal, and slasher. The oldies but goodies I watch for comfort. But sometimes I feel morbid about my life, and I have to throw in some morbid films that disturb the shit out of me. I am not usually a fan of torture porn or body horror, but in times like tonight, my mind just says, ""Go ahead, travel down the rabbit hole, and you know where the stop button is."" My limits are anything that has to do with eating strange or gross things, scenes with vomit or excrement (okay so vomit occurs in 80% of horror movies, so yes I know how to mute or fast forward lol), and slow torture is a huge nope. With that said, I will declare ahead of time that I will NEVER watch Human Centipede (2009 or the sequel), Martyrs (2008 or 2015), or A Serbian Film (2010). Now that I got that out of the way, today I decided to check out Bad Seeds/Bad Kitties (2012) and Megan is Missing (2011). Now",Discussion,1m9oob1,[],1.5,7.5,782.5,2.414634146341464,14.206907392222222,0.970835999286582,837.9291694417504,Reviews & Discussions,high
televisionsuggestions,Shows my dad who is 64 would like with no violence or people dying,salmonslamm,41,0.94,176,2025-07-26 15:49:23,https://www.reddit.com/r/televisionsuggestions/comments/1m9wo3b/shows_my_dad_who_is_64_would_like_with_no/,My dad is going through a mental health crisis and we’re trying to find shows he can actually watch. Mind you he’s watched most of what I recommend and I watch a ton of wholesome tv. He loves sci fi but is willing to give anything a try. Pls help lol ,,1m9wo3b,[],0.8,4.0,745.0,4.190476190476191,7.394962947777778,0.9847118951695728,808.1103619013317,Recommendation Requests,high
MovieSuggestions,"I need some movies that are based around children, ideally with some comedy but also fun to watch as an adult.",RiloViolet,23,0.83,157,2025-07-26 15:33:50,https://www.reddit.com/r/MovieSuggestions/comments/1m9wa4n/i_need_some_movies_that_are_based_around_children/,"My grandpa is loving this kind of movie and is wanting more recommendations. He seems to like coming-of-age themes, doesnt really like if the whole movie is too serious but is ok with serious themes. He loves Uptown Girls, Bridge to Terebithia and My Girl. Bonus points if it's available on Prime or Disney+ Canada as those are what he has access to right now. Thank you in advance!",I'M REQUESTING,1m9wa4n,[],0.8,4.0,651.0,6.541666666666667,7.654129614444445,0.9841803626371924,705.8014160768122,Recommendation Requests,high
anime,"""Playing Death Games to Put Food on the Table"" Teaser Visual",zenzen_0,468,0.97,51,2025-07-26 03:00:45,https://i.redd.it/z7aeu98cw4ff1.jpeg,,Official Media,1m9imim,[],1.0,5.0,723.0,0.1087420042643923,20.205518503333334,0.9587788550560808,693.1971122055464,News & Announcements,medium
animesuggest,What is the most recent fav anime you watched?,idkwhatever24,63,0.91,144,2025-07-26 10:25:20,https://www.reddit.com/r/Animesuggest/comments/1m9pyc0/what_is_the_most_recent_fav_anime_you_watched/,"I have so many ongoing animes but I feel like I have no interest in them. The last one that got my interest was probably Apothecary Diaries.   
   
What is something else you guys watched recently (old or new) that became an instant fav? I'm talking couldn’t stop until you finished it.   
   
Any genre is more than fine. ",What to Watch?,1m9pyc0,[],0.8,4.0,639.0,2.25,12.79579628111111,0.9736942766846024,686.090642801461,Recommendation Requests,high
MovieSuggestions,I'm looking for recommendations for movies from the 70s and 80s with frequent scenes of female nudity.,LisztF,54,0.67,114,2025-07-26 21:42:14,https://www.reddit.com/r/MovieSuggestions/comments/1ma55ud/im_looking_for_recommendations_for_movies_from/,"Good day everyone. I'm looking for **films from the 70s and 80s that feature many explicit scenes of fully nude female bodies.** They can be well-developed films with a good, high-quality script. They can also be films with subpar stories, poor scripts, or low-budget ones. My only interest is whether the film has extensive **scenes of fully nude women**, or if it has short scenes, several. You know, a film that can be summed up as ~~pussy~~, ~~boobs~~, and ~~ass~~.   
  
I want to clarify that I'm not looking for erotic films or gore films, but rather films in which female nudity is a prominent feature. If you're someone who's going to comment that I should Google it or that I'm a hopeless pervert, please save your comment.   
  
I appreciate those who take the time to share their recommendations. I thank you in advance for your attention and wish you a happy rest of the day.",I'M REQUESTING,1ma55ud,[],0.8,4.0,510.0,2.0727272727272728,1.5141296144444445,0.9968505333114456,559.3937719888372,Recommendation Requests,high
netflix,Give me some shows to watch!,VanillaBoth5026,18,0.85,79,2025-07-26 02:59:06,https://www.reddit.com/r/netflix/comments/1m9ilcv/give_me_some_shows_to_watch/,Give me some good shows to watch on Netflix I’m down for any genre it doesn’t matter just give me some of your favorites bc I’m bored af rn. It can also be a movie but I wanna find a show that I can binge watch on Netflix to start off my weekend. So what should I watch that is good??,What Should I Watch?,1m9ilcv,[],1.2,6.0,492.0,4.157894736842105,20.233018503333334,0.9587239265909966,520.8921718827703,Recommendation Requests,medium
MovieSuggestions,Looking for movies that blow your mind while being high,Appropriate_Oil9916,15,0.71,106,2025-07-26 14:16:23,https://www.reddit.com/r/MovieSuggestions/comments/1m9ufew/looking_for_movies_that_blow_your_mind_while/,"I am looking for movies that I can watch while being high, I would prefer mind bending movies that blow your mind away. 

Some of the movies that I watch and have liked are

Fight Club, Se7en, American psycho, Old Boy, Predestination, Shutter Island",I'M REQUESTING,1m9ufew,[],0.8,4.0,439.0,6.625,8.944962947777778,0.981537224869836,474.7948417178581,Recommendation Requests,high
horror,The Fog (1980) is one of Carpenter's most underappreciated horror films and that's a shame because I love it.,Emotional-Chipmunk12,124,0.93,38,2025-07-26 22:23:28,https://www.reddit.com/r/horror/comments/1ma63nv/the_fog_1980_is_one_of_carpenters_most/,"I love the kills and how gruesome they were despite having little blood, the fog itself was well utilized, the ghost pirates still scare the shit out of me with their piercing red eyes, it's all great classic horror fun. And that opening scene with the pocket watch by the fire... my god, is that awesomely chilling. It's amazing how well it's held up in the last 45 years. Just don't watch the 2005 remake. Now that's a piece of crap. Tom Welling deserved to be in better films.",Hidden Gem,1ma63nv,[],1.5,7.5,409.0,0.304,0.8269073922222222,0.998278759302992,449.19601255492375,Reviews & Discussions,medium
netflix,Untamed,kathyknitsalot,40,0.84,60,2025-07-26 23:40:38,https://www.reddit.com/r/netflix/comments/1ma7qv2/untamed/,"Just finished watching this and I feel like something was off. I usually like Eric Bana and Sam Neill, and the story was interesting but I don’t know if it was the writing or acting.  It was hard to get into the characters.  Any of them. Anyone else have an opinion? ",Question,1ma7qv2,[],1.2,6.0,400.0,1.4634146341463414,-0.4592037188888889,1.000957132173283,440.3828528693133,Reviews & Discussions,medium
criterion,The NYC 5th Avenue Barnes and Noble....I've heard legends...,Menitta,246,0.98,20,2025-07-26 16:29:57,https://www.reddit.com/gallery/1m9xo4s,"Its....beautiful. 2nd to last day of the sale and I made it out to NYC. Unfortunately, it was just my luck that the handful of movies I wanted to pick up (The Player, Lone Wolf and Cub, and Millers Crossing) were all out of stock lol. 

Technically this is a haul post so!

1. I'm really excited to see Scarface. I only recently learned the Al Pacino movie was technically a remake. 

2. Yojimbo in particular I've wanted for a while. I've seen A Fistful of Dollars but never Yojimbo. 

3. All of these (except Sinners but that's not Criterion lol) are blind buys. They all seemed super interesting. 

4. Hopefully I can finally get Lone Wolf and Cub soon lol. ",Pickup,1m9xo4s,[],2.0,10.0,446.0,0.0809716599190283,6.718851836666667,0.9860999030178568,439.8005567459641,Lists & Rankings,high
televisionsuggestions,Looking for Criminal Shows: NOT COPS!,darnellfetzervalve,12,0.84,75,2025-07-27 00:50:19,https://www.reddit.com/r/televisionsuggestions/comments/1ma95jw/looking_for_criminal_shows_not_cops/,"Anyone have some good crime shows about the criminal side of things? I get so freaking bored watching cops bust people or investigate cases, I just don't care. So please don't recommend shows with a cop/detective heavy focus.

I've already seen Breaking Bad and Dope Thief which I both love. I tried Snowfall, but it had 3 different storylines that I just couldn't get into.

Thanks for any suggestions y'all have!",,1ma95jw,[],0.8,4.0,312.0,5.769230769230769,-1.620592607777778,1.0033819404992508,344.25516543576623,Recommendation Requests,high
horrormovies,Confession time: what are some movies you’re embarrassed to say you haven’t seen yet?,twzoneq,7,0.77,39,2025-07-26 03:23:17,https://www.reddit.com/r/HorrorMovies/comments/1m9j22d/confession_time_what_are_some_movies_youre/,,,1m9j22d,[],1.5,7.5,299.5,4.875,19.829962947777776,0.959529304274573,317.3290266302346,News & Announcements,low_opinion
MovieSuggestions,Hi! I’m looking for suggestions for bad/stupid movies that are just fun,slippityslopbop,14,0.9,68,2025-07-26 18:23:29,https://www.reddit.com/r/MovieSuggestions/comments/1ma0gix/hi_im_looking_for_suggestions_for_badstupid/,"I’m talking about objectively bad movies that aren’t necessarily meant to be stupid (like Adam Sandler comedies for example) that are still super enjoyable. Examples of movies I’m talking about that I’ve seen recently are Beekeeper, Nerve, and Drop. 

Beekeeper knew exactly what it was and fully leaned into it and I really just loved that movie. Drop was honestly so bad and cheesy, just such a completely unrealistic script, but I still enjoyed it! So, more movies like that please! (Action/thriller/suspense is probably the vibe I’m going for)",I'M REQUESTING,1ma0gix,[],0.8,4.0,286.0,4.533333333333333,4.826629614444445,0.9899949089282652,311.7385439534839,Recommendation Requests,high
criterion,Anybody?,KING3THREE3,31,0.75,22,2025-07-26 17:15:18,https://i.redd.it/znvk7skr49ff1.png,Has anyone picked up any of the Criterion 'Premieres' titles during the sale? What did you pickup or which ones would you recommend? This one obviously caught me eye..,Discussion,1m9yssx,[],2.0,10.0,251.0,0.6875,5.963018503333334,0.9876538911440732,273.0011266771624,Lists & Rankings,high
MovieSuggestions,Movies that you’d recommend to anyone,brand0o0o0,13,1.0,53,2025-07-26 07:04:32,https://www.reddit.com/r/MovieSuggestions/comments/1m9mwt8/movies_that_youd_recommend_to_anyone/,"love watching movies but can never find the right ones to watch. A few of my favorites are :

Dirty Harry (1971), Sin City (2005), Reservoir Dogs (1992) , No Country for old men (2007) , and Seven (1995)

I’m open to any recommendations from any genre but I really like movies with the same feel as these",I'M REQUESTING,1m9mwt8,[],0.8,4.0,225.0,3.7857142857142856,16.142462947777776,0.9669290754599515,240.0590419784891,Recommendation Requests,high
animesuggest,Battle Shonen that's grounded?,RedNUGGETLORD,18,0.88,50,2025-07-26 08:45:08,https://www.reddit.com/r/Animesuggest/comments/1m9og77/battle_shonen_thats_grounded/,"I am looking for a battle Shonen that has no city or planet busting attacks, where none of the characters can wipe out armies. 

For example, a lot of people see HxH as this, but some of the characters are still ""punching as hard as missiles"", surviving Nukes and destroying mountains with a single blast, I want something more like ""The Boys"" where the strongest character gets hurt by a punch that doesn't even destroy a wall ",What to Watch?,1m9og77,[],0.8,4.0,218.0,2.631578947368421,14.46579628111111,0.9703125182754389,233.3281289840457,Recommendation Requests,high
televisionsuggestions,In need of a new TV series to binge!,justthatgirlxo,6,0.8,51,2025-07-26 18:05:44,https://www.reddit.com/r/televisionsuggestions/comments/1ma013u/in_need_of_a_new_tv_series_to_binge/,"Hey, so I’m desperately in need of a new TV series to watch. My fiancée and I have just finished watching the Fall and before this, we binge watched Ripper Street! 

I really enjoy anything crime related, I love documentaries and true crime too. Some of my favourite series include
- The Witcher 
- Ripper Street 
- Taboo 
- Vikings 
- The last kingdom
- Orange is the new black 
- The fall 
- Dexter 
- Peaky blinders

My fiancée likes all of the above, but he also enjoys Suits, and Gilmore girls. Any recommendations would be great! He won’t watch any true crime documentaries unfortunately, so if you have any of those I’ll have to save them for a time when I’m alone, and I’m not a fan of Breaking bad (I know😅) Thank you for taking the time in advance😊",,1ma013u,[],0.8,4.0,210.0,7.285714285714286,5.1224629477777786,0.9893849438019836,228.77083819841653,Recommendation Requests,high
