subreddit,title,author,score,upvote_ratio,num_comments,created_utc,url,selftext,link_flair_text,post_id,top_comments,comment_multiplier,adjusted_comment_weight,base_score,engagement_ratio,hours_old,time_bonus,popularity_score,category,classification_confidence
pennystocks,Complete list of resources for making your own DD,I_killed_the_kraken,294,0.99,46,2025-07-26 11:26:29,https://www.reddit.com/r/pennystocks/comments/1m9qyop/complete_list_of_resources_for_making_your_own_dd/,"Here is a full list of resources that you can use for your stock market research.

* Benzinga and MarketBeat: to find analyst ratings.
* Finviz: to access financial information.
* Finbox and StockRover: to filter and find interesting companies and to evaluate their Piotroski score.
* StockWits and AfterHour (app): to interact with the community of each stock.
* Nasdaq, CEO Buys and InsiderDashboard: to monitor insider purchases.
* Holdings Channel: to find out which funds and institutions have purchased shares of a company.
* TipRanks: to analyze the annual performance of analysts covering each company.
* Finchat: for quick and easy access to all revenue reports.
* Dilution Tracker: for casual traders exploring dilution.
* SEC website: to search company fillings.
* FRED 10y vs 2y maturity bonds curve: some say it's a good predictor of crashes.
* Dataroma: to track superinvestors portfolios.
* IPOScoop: IPOs tracker.
* TradingEconomics: calendar to monitor the publication of different r",:DDNerd: 🄳🄳 :DDNerd:,1m9qyop,[],1.5,7.5,639.0,0.1559322033898305,11.77206289,0.9757731664344969,623.5190533516435,Analysis & Education,high
personalfinance,38 recently divorced,Internal-Sir1132,74,0.76,118,2025-07-26 14:00:42,https://www.reddit.com/r/personalfinance/comments/1m9u2di/38_recently_divorced/,"As the title suggests, I’m 38 years old and recently went through a breakup with my wife, who I had been with since I was 28. The split was amicable. Life threw a few challenges our way, and over time we simply grew apart. I’ve been struggling to cope with the loss and move through the stages of grief, but now that I’m starting to pick up the pieces, I’m looking for some guidance.

We don’t have children, and we both earned around $90,000 a year, which allowed us to live comfortably. Now that she’s gone, I’ve been left with the house. It comes with a $2,700 mortgage and all the usual bills. I’ve put together a budget based only on essentials, and after everything is paid, I’m left with about $500 at the end of each month. I have no debt and a paid off 2017 Mazda with only 65k miles and in good condition. 

I have $50,000 in a high-yield savings account as a 12-month emergency fund, and I recently received a $200,000 inheritance that is currently sitting in another high-yield savings ac",Budgeting,1m9u2di,[],0.8,4.0,546.0,1.5733333333333333,9.201785112222222,0.981012197600582,590.2326598899178,Personal Trading Stories,medium
Bitcoin,"Daily Bitcoin meme until BTC is at $200,000 #52",moonlightvle,405,0.95,10,2025-07-26 08:49:30,https://i.redd.it/tgdi29uim6ff1.jpeg,,,1m9oifx,[],3.0,15.0,555.0,0.0246305418719211,14.388451778888887,0.9704688815785316,538.6102292760851,Personal Trading Stories,medium
stocks,"With the VIX being so low, is it time to buy UVIX?",SmallAl,36,0.73,44,2025-07-26 02:31:06,https://www.reddit.com/r/stocks/comments/1m9i27y/with_the_vix_being_so_low_is_it_time_to_buy_uvix/,"Hey everyone, sorry if this has been asked recently, but I couldn't find anything.

Basically, I am too scared to invest in anything right now - the VIX is below 15, and we are at 75/100 on the Greed/Fear index. I have been thinking of buying UVIX or UVXY, would that be a good idea? I understand that it is *risky* and designed for the short term, so I am not sure if I should do this now or wait more.

Thank you!

EDIT: so that’s a no, thanks for the advice everyone, I will hold cash for now ",Advice Request,1m9i27y,[],2.0,10.0,476.0,1.1891891891891893,20.695118445555558,0.9578013993264408,503.51346607938586,Questions & Help,high
personalfinance,Would you stop contributing to your 401k to buy a house?,hiiiiiiiiiiihihihi,35,0.68,104,2025-07-27 01:53:17,https://www.reddit.com/r/personalfinance/comments/1maadt1/would_you_stop_contributing_to_your_401k_to_buy_a/,"Let me be clear about something first before it’s assumed this is the dumbest thing you’ve ever heard. 

My work contributes 18% of my pay to my 401k. So I will max out my portion this year, and my work is contributing the other ~48k to max the total 401k limits. When I max out the 401k, the 18% just rolls into my paycheck as overage. 

So next year I’d still looking at 50-55k contributed to my 401k without adding anything myself. 

Pay goes up every year and I have the ability for a promotion to increase my pay 30-40% with a worse schedule. 

Next part is affording the mortgage. I’m in a HCOL area and just want to finally get in the market. I’ve never had such a high payment before and looking at these numbers makes me nervous. But seeing that I could possibly skip $2k of 401k contributions per month, makes these numbers a bit more palatable. If things worked out and the months were not as tight as I thought, I could increase my contributions again. 

Thought? Still dumb?",Housing,1maadt1,[],0.8,4.0,451.0,2.888888888888889,-2.674603776666667,1.005587644175679,498.6200275232313,Personal Trading Stories,medium
options,Robinhood or Schwab,IllNobody9085,10,0.64,90,2025-07-26 03:16:27,https://www.reddit.com/r/options/comments/1m9ixd8/robinhood_or_schwab/,"I know Robinhood is $0 per contract and Schwab is $0.65, but IMO Schwab has more tools and instruments for me to understand the options better. Anyone got any advice? I'm kind of new to options  and just wanted to make some cash-secured puts so any help would be appreciated.",,1m9ixd8,[],1.0,5.0,460.0,8.181818181818182,19.939285112222223,0.9593107920332768,487.2829643353073,Questions & Help,medium
stocks,Do you think Uranium stocks are just another AI play right? Are they tightly coupled?,Previous-Display-593,21,0.62,42,2025-07-26 17:21:56,https://www.reddit.com/r/stocks/comments/1m9yyrb/do_you_think_uranium_stocks_are_just_another_ai/,"I have been riding the Uranium train for about 4 years (Cameco + UUUU for a few months) now and it has been a great ride so far.

I am starting to get worried that the strength of Uranium stocks is almost exclusively being driven by AI hype and speculated datacenter energy demand. I am concerned that any sort of AI correction will impact the big Uranium players as much as it will impact Nvidia.

Does this seem like a reasonable take?

",,1m9yyrb,[],2.0,10.0,441.0,1.9090909090909087,5.847896223333334,0.9878907965686576,479.7598412867781,Questions & Help,medium
cryptocurrency,"Ethereum price targets $4,000 as ETH ETFs add $5.1 billion",Abdeliq,163,0.9,25,2025-07-26 19:22:47,https://crypto.news/ethereum-price-targets-4000-as-eth-etfs-5-1-billion/,,GENERAL-NEWS,1ma1w9h,[],2.5,12.5,475.5,0.1524390243902439,3.8337295566666665,0.9920448742548468,471.7173377081797,Market News & Politics,high
forex,4 months of FTMO funded journey with max allocation,Actual_Builder1197,97,0.97,38,2025-07-26 05:19:29,https://www.reddit.com/r/Forex/comments/1m9l5zb/4_months_of_ftmo_funded_journey_with_max/,"I began trading with prop firms toward the end of 2023, without much understanding of what I was doing. I struggled through the challenges and faced consistent losses. In 2024, things improved slightly—I had some strong months, but there were also days where I risked losing an account in a single session. The second half of the year was particularly rough. I was burning through challenges quickly, treating it more like gambling than trading. Instead of stepping back to analyze my mistakes, I kept pushing forward, as if I were playing a video game—restarting every time I failed, only to repeat the same errors.

Eventually, I hit a wall. I could no longer afford to buy new challenges, and that forced me to reflect. I had failed most of my challenges with 5ers and FTMO. My strategy was primarily scalping 15-minute to 1-hour setups, which didn’t align well with my Pacific Time Zone. My trades typically lasted around 30 minutes.

Since then, I’ve shifted to a more sustainable approach—tradi",Prop Firms,1m9l5zb,[],1.8,9.0,439.0,0.3877551020408163,17.888729556666664,0.963417724998209,466.84038127421377,Personal Trading Stories,medium
daytrading,Why Profitable Traders Rarely Share Their Strategies – A Hard Truth I Learned After 4 Years,Vegetable_Ferret2328,39,0.74,43,2025-07-26 19:13:09,https://www.reddit.com/r/Daytrading/comments/1ma1ny9/why_profitable_traders_rarely_share_their/,"After struggling for three years in the forex market and finally becoming profitable in my fourth, I found myself asking a tough question: Why don’t experienced traders share their actual strategies?

I noticed that out of every 100 traders, maybe only two are willing to share a fully documented strategy—including any proprietary indicators, pairs they focus on, or their specific rules for execution. Even my mentor, who has over 11 years of experience, never actually gave me his strategy. Instead, he offered advice and guidelines, making me believe that following his teachings would eventually lead to consistent profitability. It helped, yes—but only to a point.

Let me break down a typical reason why profitable traders stay tight-lipped.

Take Smart Money Concepts (SMC) or even traditional support and resistance strategies. These approaches have been around for years. But when strategies become popular, they also become predictable. The same institutions and large players in the marke",Strategy,1ma1ny9,[],1.8,9.0,426.0,1.075,3.9942851122222223,0.991713099920824,465.0697805662711,Personal Trading Stories,medium
thetagang,Daily r/thetagang Discussion Thread - What are your moves for today?,satireplusplus,8,0.79,70,2025-07-26 03:00:54,https://www.reddit.com/r/thetagang/comments/1m9imm7/daily_rthetagang_discussion_thread_what_are_your/,Keep it friendly and civil; this is not WSB and automod will censor your posts at will for unsavory and unfriendly remarks. Try to keep shit posting and bragging to a minimum.,Discussion,1m9imm7,[],1.2,6.0,428.0,7.777777777777778,20.198451778888888,0.9587929706307624,453.1633914299664,Community Discussion,high
financialindependence,$5mm Milestone - No family money,SevenSwami,113,0.76,75,2025-07-26 03:12:50,https://www.reddit.com/r/financialindependence/comments/1m9iuv8/5mm_milestone_no_family_money/,"TLDR: Got a good education; Got a high paying job.

**Current Situation**:

Logged into Fidelity this morning and realized that we (F39; M40) ticked over the $5mm milestone today. 

I am a M&A partner at a midsized law firm. She is a physician assistant. We have two kids in a VHCOL area.

Our assets are:

- $1.3mm in 401k/profit sharing plan (me)
- $700k in 401k (wife)
- $3mm in brokerage account (VOO/QQQ; a few single stocks (less than $500k in aggregate))

We also have a $2.2mm house with $1.2mm of debt on it, but I don't count that as part of our NW.

**Background**:

Neither of us come from money. My parents and I left China in 1990 shortly after Tiananmen Square. My dad borrowed $200 from his college professors. We flew with suitcases full of rice and other dried goods so we had food to eat after we arrived. Apparently they heard rumors that salt was expensive in America so my mom brought pounds of salt with her. My mom stole the metal airplane silverware and that was the silverwa",,1m9iuv8,[],0.8,4.0,413.0,0.6578947368421053,19.99956289,0.9591903305914184,437.44560653425583,Personal Trading Stories,medium
investing,Vanguard's forecasts not so rosy,ya-reddit-acct,42,0.79,60,2025-07-26 09:05:27,https://www.reddit.com/r/investing/comments/1m9oqxc/vanguards_forecasts_not_so_rosy/,"How are [the Fortune interview with Greg Davis, of the Vanguard Group](https://corporate.vanguard.com/content/corporatesite/us/en/corp/vemo/vemo-return-forecasts.html), [and the actual Vanguard Capital Markets Model forecast](https://corporate.vanguard.com/content/corporatesite/us/en/corp/vemo/vemo-return-forecasts.html) changing your investment strategy?",,1m9oqxc,[],1.2,6.0,402.0,1.3953488372093024,14.122618445555554,0.9710064949720124,430.54461097874895,Analysis & Education,medium
investing,Where to buy gold and silver,BestAirport176,6,0.64,65,2025-07-26 09:35:18,https://www.reddit.com/r/investing/comments/1m9p6y4/where_to_buy_gold_and_silver/,"Hello! I was wondering what everybody thinks about buying gold or silver right now. I don’t quite have enough to buy an ounce of gold right now, so I’d be getting silver. I’m 18 and this would be a long term investment. 

If so, where is the best place to buy gold or silver? Thanks in advance!",,1m9p6y4,[],1.2,6.0,396.0,9.285714285714286,13.625118445555556,0.9720134244755436,424.5173160923152,Questions & Help,medium
cryptocurrency,Time Flies,TheGreatCryptopo,333,0.96,6,2025-07-26 22:09:34,https://i.redd.it/lxxu9apekaff1.png,,MEME,1ma5si2,[],2.5,12.5,408.0,0.0179640718562874,1.0540073344444445,0.9978065604984696,407.1050766833756,Memes & Entertainment,high
daytrading,"Don't let anyone tell you what's possible and what isn't. Block out the noise and focus on process. Finally dug out of the pit of despair, what a crazy month (+193%) it's been!",laddie78,34,0.89,35,2025-07-26 15:27:05,https://imgur.com/a/zfmOMol,,P&L - Provide Context,1m9w4as,[],1.8,9.0,349.0,1.0,7.76206289,0.98395908374521,378.3017202270783,Personal Trading Stories,medium
personalfinance,Should I sell my RSU’s to get out of debt and start from scratch?,lemicat_,18,0.75,77,2025-07-26 13:16:46,https://www.reddit.com/r/personalfinance/comments/1m9t40j/should_i_sell_my_rsus_to_get_out_of_debt_and/,"What I’m about to share is a bit shameful so please be nice. 

I’m in a lot of debt, probably around $40k in consumer debt and $20k in student loans. I have always been notoriously awful at managing my money. I have consistently been saving and setting money aside but I also spend more than I bring in which led me into the situation above. I’ve gotten to a place where my emergency fund is solid and I have a budget in place that I’m being strict with myself about so I want to tackle my debt next.

I recently started a job that offered RSUs that I can sell to totally clear out my consumer debt and still have about 75% of the total RSUs left over. I brought up this idea to my cousin and he said it wouldn’t be a good idea to sell because those stocks should grow. In my eyes, I’m just paying interest and want to be done with the debt. I made a lot of spending mistakes in the past but I’m in a new headspace and never want to see myself in this position again.

So I’m in need of some advice. ",Debt,1m9t40j,[],0.8,4.0,326.0,4.052631578947368,9.934007334444445,0.9795168406727116,351.922490059304,Personal Trading Stories,medium
pennystocks,"Mentions, July 26",TradeSpecialist7972,35,0.89,39,2025-07-26 10:45:09,https://i.redd.it/sybpz53777ff1.jpeg,,:snoo_dealwithit: General Discussion :snoo_dealwithit:,1m9q9r8,[],1.5,7.5,327.5,1.0833333333333333,12.460951778888887,0.9743737556889176,351.8574049881205,Community Discussion,high
stocks,RKT earnings July 31st - Thoughts?,Chiiiiipu,31,0.86,29,2025-07-26 16:08:34,https://www.reddit.com/r/stocks/comments/1m9x5fk/rkt_earnings_july_31st_thoughts/,"As title - what say you? Analysts think they’ll miss earnings though analysts have been wrong and right.

But what’s your opinion - will they beat or miss earnings?

A positive earning call could shoot the stock up a bit as its heavily shorted while a miss will drag it back lower.

I of course hope for a positive one but I think it’ll be more flat.",Company Discussion,1m9x5fk,[],2.0,10.0,321.0,0.90625,7.070674001111112,0.985377393248614,348.4061432328052,Community Discussion,high
CryptoMarkets,Still holding my ADA bag from 2018… Should I finally let go?,LumiCurvesThatFlow,48,0.81,92,2025-07-26 08:03:23,https://www.reddit.com/r/CryptoMarkets/comments/1m9ntqy/still_holding_my_ada_bag_from_2018_should_i/,"I’ve been holding ADA since 2018. I believed in the project early on and I still like a few things about Cardano. But over time, I’ve averaged my position down to about $1.50, and I’m starting to question whether it’s worth holding onto anymore.

Back in the day, I saw all the confident predictions that ADA could hit $5–$7 easily, even when market cap logic didn’t quite add up. I got back into crypto around 2022 and have since been through every theory out there:
	•	Left-translated cycles, extended cycles, or… no cycle at all
	•	Institutions ruined everything
	•	Alt season is gone forever

Now I’m wondering if I should just take the loss, wait for the next bear market (whenever that comes), and reassess with fresh eyes, probably leaning more into BTC or other promising alts.

So my question is - what’s your honest outlook for ADA at this point?
	•	Do you still think it could return to ATH?
	•	Should I wait a bit longer?
	•	Or if you’re still bullish, what gives you conviction?

I know ",Discussion,1m9ntqy,[],0.6,3.0,324.0,1.8775510204081636,15.15706289,0.9689161393313588,346.3288291433602,Community Discussion,high
pennystocks,Am I doing this right ?,GodMyShield777,222,0.96,13,2025-07-26 15:30:31,https://i.redd.it/8wkh14byl8ff1.jpeg,,:penny2: MΣMΣ :penny:,1m9w7a7,[],1.5,7.5,319.5,0.0582959641255605,7.704840667777778,0.984076391415176,314.4124070571488,Questions & Help,medium
daytrading,How long did it take you to reach 50k?,Current_Abroad_552,17,0.87,31,2025-07-26 03:08:38,https://www.reddit.com/r/Daytrading/comments/1m9is1z/how_long_did_it_take_you_to_reach_50k/,"Im in no rush, have been trading and learning consistently for a few months now and am more confident than I was in the beginning! Im just curious, i'm not doing this as a way to earn income but it is a goal of mine. Ive heard people say that its more of a snowball effect rather than a steady journey, but its pretty steady for me since i've just started. ",Question,1m9is1z,[],1.8,9.0,296.0,1.7222222222222223,20.06956289,0.9590504588674348,313.47893582476075,Questions & Help,high
personalfinance,$75k gross single income—is a house attainable?,GladLoquat3732,16,0.64,65,2025-07-27 01:35:22,https://www.reddit.com/r/personalfinance/comments/1maa16s/75k_gross_single_incomeis_a_house_attainable/,"first ever post, and hoping i’ve included all of the necessary info! please let me know if there’s anything important i missed.

i’m single in my 20s and will be at a guaranteed $75k annual gross salary next year (~$4520 after 401k contributions, taxes, and health insurance are taken out). i have budgeted to have about $65k in savings by the end of next year (with extra money budgeted for emergencies as well). i’m hoping to put down $30k for a downpayment with an extra $10k in downpayment assistance (interest + payment free until after mortgage is paid off) from my local credit union. this would leave me with about $10k for closing costs and $25k for my emergency fund.

credit score is 750+ and i have about $400 a month in student loan debt, with no other debts. paying my federal loans at a reduce ibr rate and aiming for pslf forgiveness in 10 years. paying extra each month on my private loan, and should be paid off by 2030. my job has a contract guaranteed, union protected raise of ab",Housing,1maa16s,[],0.8,4.0,276.0,3.823529411764706,-2.375992665555556,1.0049622561336864,304.96958269289746,Personal Trading Stories,medium
pennystocks,$GAMB might be the most underrated stock under $500M market cap,_Forthefuture_,39,0.79,32,2025-07-26 13:24:28,https://www.reddit.com/gallery/1m9ta1z,"We’re talking about a company that consistently beats earnings expectations, has solid double-digit profit margins, strong free cash flow, and yet it trades like a company on life support. Right now it’s hovering around $10.90 and in a clear downtrend, but the fundamentals tell a very different story.

Gambling.com Group isn’t an operator. They don’t take on gambling risk. They’re an affiliate marketing company a high-margin, capital-light business that generates qualified leads for sportsbooks like FanDuel, DraftKings, and BetMGM. Think “picks & shovels” in the online betting gold rush. They monetize conversions, not bets.

What sets GAMB apart is how methodically they’ve expanded across the U.S. as states legalize online sports betting. They’ve done the legal diligence, obtained licenses in every new state ahead of time, and built out a compliant and scalable system. That backend work which 99% of people don’t even see, gives them a multi-quarter advantage over any new entrant trying",:DDNerd: 🄳🄳 :DDNerd:,1m9ta1z,[],1.5,7.5,279.0,0.8,9.805674001111113,0.9797787603955996,301.2582741503723,Analysis & Education,high
