subreddit,title,author,score,upvote_ratio,num_comments,created_utc,url,selftext,link_flair_text,post_id,top_comments,comment_multiplier,adjusted_comment_weight,base_score,engagement_ratio,hours_old,time_bonus,popularity_score,category,classification_confidence
wallstreetbets,sent this to my CPA,Jeeperg84,45169,0.97,452,2025-07-26 14:59:13,https://i.redd.it/xf0royuig8ff1.jpeg,,Meme,1m9vfpn,[],1.5,7.5,48559.0,0.0100066415762674,8.226507334444445,0.9830074726845148,47733.85986608736,Memes & Entertainment,high
stocks,What are we investing in during these crazy times?,MindGames7777,346,0.85,428,2025-07-26 04:33:30,https://www.reddit.com/r/stocks/comments/1m9kcri/what_are_we_investing_in_during_these_crazy_times/,"So in April when stock prices were down, I scraped up all the cash I could and added more of what currently hold. Since I’ve been just saving up to have some cash on hand and now I’m ready to put more money in the market but like everyone I’m concerned the bubble will burst soon but don’t want to sit and wait so I am curious what is everyone buying during these crazy times? I just added some more WM this week and some GOOGL a couple weeks ago. Thanks

EDIT. A few people tell me to DCA or VOO and chill. I get it but in just not here for that. I’ve invested in real estate for 20 years and 3-4 years ago got into stocks to diversify and because it’s interesting. I’m enjoying the conversation and interesting suggestions here. I’ll be reading and learning about your suggestions. Thank you. ",,1m9kcri,[],2.0,10.0,4626.0,1.2334293948126802,18.655118445555555,0.9618807176848676,4912.260200010199,Analysis & Education,medium
Bitcoin,Respect to those of you who HODL,Shepherding,304,0.89,284,2025-07-26 06:42:20,https://www.reddit.com/r/Bitcoin/comments/1m9mjvt/respect_to_those_of_you_who_hodl/,"I just wanted to pay my respects to the HODLers. Last night, I was having dinner at a restaurant, glass of wine in hand. I’m new to Bitcoin but have invested in the past week. I’m checking my phone every 10-30 seconds, the price, $117.5k…$116.5k…$116k…Sell? Wtf is going on…$115k…..ffs….$114.9k.  Do I sell and cut my losses? Is this going down to $110k? How much will I have lost? I’ve already lost more than the car I decided not to buy. How long will I have to hold to make up for these losses? Maybe I’m just not cut out of this, too much anxiety. I left the bar to run to my car to take some anxiety medication. I convinced myself, it’s only a 2% drop in the first week of ownership, I need to man up and know I’m in it for the long haul and this kind of day is common place. Took another pill to sleep last night. Then today watched it climb back up to the mid $117k’s and caught my breath. FFS, I know there are going to be shit storms, and I’m trying my best over here, but this shit is not e",,1m9mjvt,[],3.0,15.0,4564.0,0.9311475409836064,16.507896223333333,0.9661932138181812,4866.1058278661785,Personal Trading Stories,medium
cryptocurrency,What happens if Bitcoin reaches 1 million,Every_Hunt_160,268,0.77,309,2025-07-26 12:38:28,https://cointelegraph.com/explained/what-happens-if-bitcoin-reaches-1-million,,🔴 UNRELIABLE SOURCE,1m9sb00,[],2.5,12.5,4130.5,1.1486988847583643,10.572340667777777,0.9782150850875364,4453.56740895407,Market News & Politics,low
Bitcoin,Buying 1 Bitcoin,Castelbou,236,0.92,238,2025-07-26 19:32:38,https://www.reddit.com/r/Bitcoin/comments/1ma24nz/buying_1_bitcoin/,"Hi everyone. Currently sitting on USD 120k cash (thankfully I don’t need that money in the sense that my life won’t change if I lose it all). 

I am thinking of buying 1 Bitcoin, but have no previous experience with Crypto. 

I understand this is a bullish sub but would appreciate your insights on whether to invest that money in one bitcoin or not. Also, would like input on DCA (for instance 20k a month for 6 months) vs lump sum. 

Thanks!",,1ma24nz,[],3.0,15.0,3806.0,1.0042194092827004,3.66956289,0.992384225408339,4157.614361904139,Analysis & Education,medium
Bitcoin,This is a real photo taken on top of Mount Everest. Such a time to be alive.,prometheuslair,2207,0.95,70,2025-07-26 17:30:12,https://i.redd.it/tpocqicg79ff1.jpeg,,,1m9z5up,[],3.0,15.0,3257.0,0.0317028985507246,5.710118445555556,0.9881743985160052,3218.4840159666287,Memes & Entertainment,medium
Bitcoin,"$9 BILLION worth of Bitcoin shorts to be liquidated at $125,000",LifeIsJustASickJoke,1312,0.98,128,2025-07-26 16:06:44,https://i.redd.it/jkdssweks8ff1.jpeg,,,1m9x3so,[],3.0,15.0,3232.0,0.0974866717440974,7.101229556666667,0.985314668674905,3184.537009157293,Personal Trading Stories,medium
wallstreetbets,I just delete the app right?,C_L_I_C_K_,1808,0.98,140,2025-07-26 14:29:07,https://i.redd.it/hk4ozmk5b8ff1.jpeg,,Loss,1m9upmr,[],1.5,7.5,2858.0,0.0773908236594803,8.728174001111112,0.9819806300368056,2806.50064064519,Personal Trading Stories,high
Bitcoin,Today a friend of mine posted a pic of his bags and balances on socials,ScoobyD00BIEdoo,991,0.92,129,2025-07-26 01:55:15,https://www.reddit.com/r/Bitcoin/comments/1m9hcrt/today_a_friend_of_mine_posted_a_pic_of_his_bags/,"* **Update. Hacked confirmed** •




Then pic showed hes been in for 3 years. Already over 600k (well off family/great job) I decided to send him a message.

""Just here to throw some caution your way, because we were friends once. 

Ive been in crypto for awhile now and I just gotta request, for yours and your families safety that you delete your post as it paints a target on you.

People have been subject to wrench attacks and literal kidnappings in order to steal others bags. A new one every week. 

Definitely be vocal and advocate, but never show balances.

Congrats on joining the community!""

He thanked me for the the info, left the post up, then a few hours later blocked me.

Known him for 30 years. Was just offering a little advice. Good luck I guess. 


Edit: his reply seemed like AI

""I really appreciate you looking out for me and sharing this. It’s clear you’ve got a ton of experience in the space, and I respect your concern. You’re absolutely right — safety should always come",,1m9hcrt,[],3.0,15.0,2926.0,0.1300403225806451,21.292618445555554,0.9566098778780784,2799.040502671257,Analysis & Education,low
personalfinance,Is it really 6%+ APR for a new car?,shawnsblog,308,0.83,545,2025-07-26 15:30:35,https://www.reddit.com/r/personalfinance/comments/1m9w7ca/is_it_really_6_apr_for_a_new_car/,"Wife and I both have 800’s (credit scores) and ending paying off our vehicles. Of course we’re gonna hold on to them as long as possible BUT there will come a time where using them as trade ins > what they’re worth.

Seeing some car dealerships making content online and they’re making the point that no one’s getting less than 6% APR. Is this really the deal?",Auto,1m9w7ca,[],0.8,4.0,2488.0,1.7637540453074434,7.7037295566666675,0.9840786693724224,2697.1877293985867,Questions & Help,medium
pennystocks,The Lounge,AutoModerator,33,1.0,297,2025-07-26 04:01:39,https://www.reddit.com/r/pennystocks/comments/1m9jrsh/the_lounge/,"Talk about your daily plays, ideas and strategies that do not warrant an actual post. 

This is the place to request buy/sell advice from the community. 

Remember to keep it civil.

Trade responsibly.",:snoo_dealwithit: General Discussion :snoo_dealwithit:,1m9jrsh,[],1.5,7.5,2260.5,8.735294117647058,19.18595177888889,0.9608175591106548,2397.9780923696358,Community Discussion,high
Bitcoin,Why Are New Bitcoin Whales Quietly Stacking at Record Speed? What Do They Know?,tcodo,241,0.9,106,2025-07-26 07:08:26,https://www.reddit.com/r/Bitcoin/comments/1m9mz19/why_are_new_bitcoin_whales_quietly_stacking_at/,"Over 120,000 BTC was snapped up this month by wallets holding 1,000+ BTC, the biggest whale accumulation since 2021.  
Nobody’s making noise about it... but should we be paying closer attention?

What do you think, early signal, or just whale games?",,1m9mz19,[],3.0,15.0,1831.0,0.4380165289256198,16.072896223333334,0.9670692233000456,1953.803747862384,Questions & Help,medium
daytrading,Ross Cameron - Warrior Trading - Legit or not?,xXGokyXx,19,0.62,200,2025-07-26 03:32:56,https://www.reddit.com/r/Daytrading/comments/1m9j8hz/ross_cameron_warrior_trading_legit_or_not/,"I was recently recommended a video by this guy, Ross Cameron. From that video, I was recommended one titled ""[How I Made $1,000,000 in 51 Days of Day Trading (Full Training)](https://www.youtube.com/watch?v=m5zu_X-_51I&t=384s)."" Now, normally I would never have clicked it, but the video I had already watched of him made me curious, since he seemed genuine.

What grabbed my attention is that he claims he turned $500 into $12 million from 2017-2024 day trading. AND he says he is 3rd party audited.

I found out he was sued by the FTC: [https://www.ftc.gov/news-events/news/press-releases/2023/01/ftc-returns-more-29-million-consumers-harmed-warrior-trading](https://www.ftc.gov/news-events/news/press-releases/2023/01/ftc-returns-more-29-million-consumers-harmed-warrior-trading)

However, he does seemingly share his audit: [https://www.warriortrading.com/ross-camerons-verified-day-trading-earnings/](https://www.warriortrading.com/ross-camerons-verified-day-trading-earnings/)

And yes, I did s",Question,1m9j8hz,[],1.8,9.0,1819.0,10.0,19.66456289,0.959859999168892,1927.8853384882148,Questions & Help,high
Bitcoin,Imagine having so much cash on hand and not buying Bitcoin,LifeIsJustASickJoke,322,0.93,94,2025-07-26 13:33:20,https://i.redd.it/6934dh5718ff1.png,,,1m9tgym,[],3.0,15.0,1732.0,0.2910216718266253,9.657896223333331,0.9800804516839652,1870.699342316628,Personal Trading Stories,low
investing,53 year old couple with no retirement,Longjumping_Slide922,199,0.84,205,2025-07-26 21:35:05,https://www.reddit.com/r/investing/comments/1ma4zre/53_year_old_couple_with_no_retirement/,"A loving husband starts a plumbing business with the initial help of his wife. He averages 65k to 90k annually over a 25 year span. As of this current point, he owns a 40k dodge ram, a 20k RV, he owned some land and almost had it payed off, but he sold it. Oh yea, and that money went poof too.  His savings are $18,000 and he is 53 years old, still working the buisness.. no employees. Just him and a helper.   No retirement. None. And no plans to invest into anything. Just the 18k in savings... which btw, inflation has put a tremendous beat down on.  How will he be able to survive his 70s?  ",,1ma4zre,[],1.2,6.0,1429.0,1.025,1.6287295566666666,0.996612563775338,1567.0593536349584,Questions & Help,medium
cryptocurrency,The oncoming 401K inflow…,tomsmac,141,0.86,99,2025-07-26 20:56:55,https://www.reddit.com/r/CryptoCurrency/comments/1ma43zo/the_oncoming_401k_inflow/,"We’re just months away from the approval of allowing crypto into your 401K. My FA with Fidelity has told me that they’re literally building for it right now!

I’ve Now heard several times on how this will greatly impact the market with an estimated 1-10% of worker‘s paycheck to be introduced into their 401Ks. And then matched by their employer! Am I wrong in assuming that this will be a monster catalyst in the sector?

So, has anyone heard an estimate of what kind of $$ we’re talking about on a bi-weekly basis?

I have to assume that it’s not peanuts",DISCUSSION,1ma43zo,[],2.5,12.5,1378.5,0.6971830985915493,2.264840667777778,0.995292696189188,1509.8609816967958,Community Discussion,high
Bitcoin,"Bitcoin just proved again why it's the most liquid asset in the world by absorbing 80k BTC (~$10 billion) market sell, barely moving 2%",HealthyMolasses8199,550,0.95,65,2025-07-26 09:17:10,https://i.redd.it/g9l2yxzcr6ff1.jpeg,,,1m9oxbi,[],3.0,15.0,1525.0,0.1179673321234119,13.927340667777775,0.9714016086519932,1481.3874531942895,Personal Trading Stories,medium
stocks,Massive SPY PUT Volume into August & September - Hedging or Warning Sign ?,SubstantialRock821,160,0.9,119,2025-07-26 17:38:17,https://www.reddit.com/r/stocks/comments/1m9zd0h/massive_spy_put_volume_into_august_september/,"There's a massive amount of put contacts expiring on August 15th and September 19th. Is something major  coming  next week or month? Or is this just hedging? Options are relatively cheap, but the volume is huge. With Trump's tariffs potentially coming August 1st, no rate cuts in sight and the market still pushing higher - are stocks really this unstoppable, or am I just overthinking it?

What's your thoughts ?
",,1m9zd0h,[],2.0,10.0,1350.0,0.7391304347826086,5.575396223333334,0.9884517896314444,1469.40991600245,Questions & Help,medium
Bitcoin,Did the market really absorb $9B whale sale?,Majestic-Relation489,405,0.95,75,2025-07-26 01:58:37,https://www.reddit.com/r/Bitcoin/comments/1m9hf3i/did_the_market_really_absorb_9b_whale_sale/,"I read the news. 9 billion in sales plus people panic selling PLUS people selling to live, and the market absorbed it with a minor fall in price? Is this right?

Im telling my non-bitcoin buddy how if some whale sold 9B in royal bank shares (im in canada) how far those shares would go down.

I mean wow did we luck out that btc didn't dump back down to 90k.",,1m9hf3i,[],3.0,15.0,1530.0,0.1847290640394088,21.236507334444443,0.9567217103376788,1463.7842168166485,Questions & Help,medium
investing,"I really want to payoff my house, but I just can’t come up with a financial justification.",Wildcard_Wisco,42,0.68,211,2025-07-26 11:26:01,https://www.reddit.com/r/investing/comments/1m9qyeo/i_really_want_to_payoff_my_house_but_i_just_cant/,"My wife and me have been very lucky and will get ~$220k after taxes on the sale of a duplex we own and have accumulated ~$550k in a personal stock account and ~500k in retirement driven by work opportunities in the last few years. We owe $150k on our home at a 3.25% interest rate. I would love to pay it off just to be done, but just can’t justify it at that interest rate. Any advice or points for paying it off or not?",,1m9qyeo,[],1.2,6.0,1308.0,4.906976744186046,11.779840667777778,0.9757573554233248,1407.0906208937088,Personal Trading Stories,medium
Bitcoin,I feel sorry for these people,ThomasTrades,360,0.88,68,2025-07-26 13:05:25,https://i.redd.it/mnh83ct7w7ff1.jpeg,Feel sorry for people who sold. HODL,,1m9sv7f,[],3.0,15.0,1380.0,0.1883656509695291,10.12317400111111,0.9791308918623548,1351.20063077005,Personal Trading Stories,medium
cryptocurrency,My Accountant Reaction After Checking My Crypto Trades,kirtash93,993,0.97,24,2025-07-26 06:30:00,https://i.redd.it/5hd3kwanx5ff1.png,,MEME,1m9mcnd,[],2.5,12.5,1293.0,0.0241448692152917,16.71345177888889,0.9657795391031022,1248.7529440603112,Memes & Entertainment,high
daytrading,"It ain’t much, but it’s honest work.",-JKR,535,0.98,65,2025-07-26 13:59:16,https://i.redd.it/ifa121tt58ff1.jpeg,"First week of day trading, started with $1,500 to get my feet wet. Made lots of mistakes throughout the week but ultimately landed in the green side. What really made things complicated is my morning job, can’t react as quickly. Other than leaving my job… any personal advice on how you all managed?",Question,1m9u16j,[],1.8,9.0,1120.0,0.1212686567164179,9.225674001111113,0.980963375291776,1098.678980326789,Questions & Help,high
stocks,Stocks which will benefit the most if Trump’s Tariff actions are ruled to be illegal…,Flaky-Temperature-25,118,0.79,86,2025-07-26 22:40:34,https://www.reddit.com/r/stocks/comments/1ma6h5j/stocks_which_will_benefit_the_most_if_trumps/,"The US Court of Appeals will hear oral arguments regarding the legality of Trump’s tariff actions on July 31, 2025. A decision within weeks is expected thereafter, and likely further appeal to the US Supreme Court. If the Court upholds Trump’s actions, it seems to be a status quo event. But if it is ruled that the President does NOT legally have such authority, the impact might be very significant for many companies.   
In that event, which stocks would you expect to benefit the most?   
I own AAPL and assume that it would react positively. Which others would you be looking for to rise strongly on such news (if it happens.) ?",,1ma6h5j,[],2.0,10.0,978.0,0.7226890756302521,0.5373406677777778,0.99888116663675,1074.7057809707414,Market News & Politics,medium
stocks,"Class Action Filed Against Reddit, Inc. (RDDT) Over Securities Violations",azavio,532,0.92,58,2025-07-26 01:43:33,https://www.reddit.com/r/stocks/comments/1m9h4mt/class_action_filed_against_reddit_inc_rddt_over/,"https://fox40.com/business/press-releases/accesswire/1052857/class-action-filed-against-reddit-inc-rddt-over-securities-violations-contact-levi-korsinsky-today/

A class action lawsuit was filed against Reddit, Inc. for alleged securities fraud between Oct 29, 2024, and May 20, 2025. The complaint claims Reddit misled investors by hiding that Google Search changes and AI Overview reduced traffic to Reddit. Users were getting answers directly from Google, not intending to visit Reddit. This “zero-click” trend hurt traffic and ad revenue more than past declines, making Reddit’s growth projections unfounded and its public statements materially false.",potentially misleading / unconfirmed,1m9h4mt,[],2.0,10.0,1112.0,0.1088180112570356,21.487618445555555,0.9562213340435004,1063.3181234563724,Analysis & Education,medium
stocks,Figuring out the Figma IPO! (DD on $FIG),WinningWatchlist,64,0.83,76,2025-07-27 00:13:47,https://www.reddit.com/r/stocks/comments/1ma8fm5/figuring_out_the_figma_ipo_dd_on_fig/,"# I love IPOs.

The last IPO I thought was amazing was Coreweave, and I posted about it [(and how far we've come!).](https://www.reddit.com/r/stocks/comments/1jllj7u/coreweave_the_biggest_ipo_of_2025_dd_on_crwv/) Figma is IPOing on the 31st and it's going to be a big one.

**Figuring Figma Out:**

What is Figma? Figma is a ""cloud-based collaborate design platform"". The company boasts of being able to help you ""Prompt, code, and design from first idea to final product"". Imagine how useful Microsoft Office is to the average white collar worker, and that's what Figma is to the average designer.

(If you need a ELI5 and have the attention span of a 2 year old watching Cocomelon [watch this video from their site](https://help.figma.com/hc/en-us/articles/14563969806359-What-is-Figma), it's got bright colors kids crave)

Figma began with [Figma Design](https://www.figma.com/design/) for UI/UX designers, [FigJam](https://www.figma.com/figjam/) for diagramming, then [**Dev Mode** ](https://www.",,1ma8fm5,[],2.0,10.0,824.0,1.1692307692307693,-1.0162704433333334,1.002119473004548,908.1464457557475,Analysis & Education,medium
cryptocurrency,"BlackRock calls for the Fed to cut interest rates, defying Wall Street consensus",kirtash93,274,0.93,50,2025-07-26 17:38:34,https://www.cryptopolitan.com/blackrock-calls-for-the-fed-to-cut-rates/,,GENERAL-NEWS,1m9zd8t,[],2.5,12.5,899.0,0.1818181818181818,5.570674001111112,0.9884615140313756,888.6269011142066,Market News & Politics,high
financialindependence,"Daily FI discussion thread - Saturday, July 26, 2025",AutoModerator,38,0.98,193,2025-07-26 09:01:04,https://www.reddit.com/r/financialindependence/comments/1m9ookr/daily_fi_discussion_thread_saturday_july_26_2025/,"Please use this thread to have discussions which you don't feel warrant a new post to the sub. While the Rules for posting questions on the basics of personal finance/investing topics are relaxed a little bit here, the rules against memes/spam/self-promotion/excessive rudeness/politics still apply!

Have a look at the [FAQ](https://www.reddit.com/r/financialindependence/wiki/faq) for this subreddit before posting to see if your question is frequently asked.

Since this post does tend to get busy, consider sorting the comments by ""new"" (instead of ""best"" or ""top"") to see the newest posts.",,1m9ookr,[],0.8,4.0,810.0,4.948717948717949,14.19567400111111,0.9708587199284554,867.3955631420489,Analysis & Education,medium
Bitcoin,Ever regretted a transaction?,FatGirlRodeo,243,0.92,42,2025-07-26 18:31:22,https://i.redd.it/krqqwsddi9ff1.jpeg,,,1ma0ndb,[],3.0,15.0,873.0,0.1721311475409836,4.690674001111112,0.9902753556538768,864.5103854858345,Questions & Help,medium
daytrading,Made my Monthly Profit in a Single Trade !! ( My biggest trade this month ),Alone97x,134,0.96,70,2025-07-26 14:40:00,https://www.reddit.com/gallery/1m9uyyf,"Hey guys happy weekend!! this is my biggest trade this month !! 

So i took this trade on because bitcoin was bearish on Wednesday and it ended on the morning of Friday.  the higher timeframe and according to price action i knew it would drop down to the 115700 level at least as it had a fair value gap there. I took my entry, followed my plan, placed my TP and SL and let price work it self out. 

This trade had a risk to reward ratio of 1:7 and it also was the longest trade i had taken. 

i ended up making **$4900** on this trade as i did take 50% of my position off at the first TP level. 

I also screen recorded this whole trade and i will be uploading it to my YT shorts later today. 

Before anyone says it's fake i have uploaded my broker connected to my Tradingview app's screenshot as well. 

Really proud of this trade, Price action trading is superior to anything i had ever used in my life. ",Strategy,1m9uyyf,[],1.8,9.0,764.0,0.5185185185185185,8.546785112222222,0.982351784276181,826.9167631870023,Personal Trading Stories,medium
ValueInvesting,How To Profit From Trump's 'Golden Dome',Individual_Ad5883,150,0.89,119,2025-07-26 17:28:39,https://www.reddit.com/r/ValueInvesting/comments/1m9z4kr/how_to_profit_from_trumps_golden_dome/,"**TLDR:** Trump has announced a new £140bn+ 'Golden Dome' missile defence plan, which is essentially 'Star Wars 2.0'. This massive government spending programme is set to create a gold rush for defence contractors. I've done a deep dive on which companies stand to benefit the most.

Lockheed Martin (LMT): The obvious giant, making most of the existing systems the Dome will be built on. However, they just posted a disastrous earnings report (a 78% EPS miss!) and look like they might be fumbling. Is it a value trap? I have a recent article explaining in full why I don't like this one much.

Northrop Grumman (NOC): The momentum play. This company is executing flawlessly, crushing its earnings, and has already won the contracts for the next-gen B-21 bomber and Sentinel ICBMs. Crucially, their CEO just confirmed they are *already testing* the advanced space-based interceptors for the Dome.

RTX Corp (RTX): The safe ""picks and shovels"" play. They are the indispensable supplier of the advance",Stock Analysis,1m9z4kr,[],1.0,5.0,745.0,0.7880794701986755,5.735951778888889,0.9881212169499768,810.6503066277327,Analysis & Education,medium
investing,How does one rationalize the assumption that total market growth is infinite?,CleansingHum,40,0.69,113,2025-07-26 18:13:30,https://www.reddit.com/r/investing/comments/1ma07sx/how_does_one_rationalize_the_assumption_that/,"It seems to me that a glaring assumption which (nearly?) every investor makes is that the value of the global market has no finite limit. I understand that market value fluctuates, with the possibility of many years of downturn and the converse possibility of many years of growth. I doubt anyone would invest in the market if they did not expect, to some degree, that their investment would grow over a long enough time horizon.

But how do you rationalize that assumption? Is it purely based on a historical assessment that market value has tended to grow in the past, so it will continue to grow? Do you believe that, at some point in the future, the actions necessary to maintain that growth will be untenable? 

I may be veering into ideological territory here, but I’m curious what everyone’s thoughts are.",,1ma07sx,[],1.2,6.0,718.0,2.756097560975609,4.988451778888889,0.9896612086837095,782.3767478349034,Questions & Help,medium
Bitcoin,Pretty accurate,Born-Past6759,296,0.91,25,2025-07-26 22:26:57,https://i.redd.it/cyepkyfeoaff1.jpeg,,,1ma66dz,[],3.0,15.0,671.0,0.0841750841750841,0.7642851122222222,0.998409006323986,669.9324432433947,Personal Trading Stories,low
investing,Investing in companies you don’t believe in.,Dierks_Ford,16,0.62,93,2025-07-26 20:22:46,https://www.reddit.com/r/investing/comments/1ma3b8o/investing_in_companies_you_dont_believe_in/,"I’m struggling to pull the trigger with companies I don’t believe in. They have good business models and I think they’re good investments. My personal bias against them is holding me back. Two examples are Sofi and Walmart. Two companies I’d never do business with, but they seem like great investments. Am I the only one? ",,1ma3b8o,[],1.2,6.0,574.0,5.470588235294118,2.8340073344444443,0.9941132134833718,628.0209845394554,Personal Trading Stories,medium
