subreddit,title,author,score,upvote_ratio,num_comments,created_utc,url,selftext,link_flair_text,post_id,top_comments,comment_multiplier,adjusted_comment_weight,base_score,engagement_ratio,hours_old,time_bonus,popularity_score,category,classification_confidence
MovieSuggestions,Underrated horror movies on streaming I probably never seen?,poisonparty,11,0.87,45,2025-07-27 00:37:17,https://www.reddit.com/r/MovieSuggestions/comments/1ma8w6l/underrated_horror_movies_on_streaming_i_probably/,"I have Peacock, Paramount Plus, Hulu, Prime, Netflix, and HBO Max.

Some I’ve seen:

Veronica

The VVitch

Incident in a Ghost Land

Last Night in Soho

Blood Red Sky

Midsommar

Hereditary

47 Meters Down

In a Violent Nature

Longlegs

Scream (all of them)

28 days/weeks/years later

Every single The Purge (my favorite horror movie series)

Alien

Late Night with the Devil

Donnie Darko

Black Swan

All Friday the 13th

All Chucky

All The Conjuring universe

All the Insidious

Becky

You’re Next

Ready or Not

Freaky

The Babysitter

Pearl, X, MaXXXine

Sting

Og and remake Last House on the Left

The Hills Have Eyes (all of them)

Nightmare on Elm Street (all of them)

And a lottttt more. Please give me some movies actually scary that I probably haven’t seen and if available where they’re streaming.",I'M REQUESTING,1ma8w6l,[],0.8,4.0,191.0,3.75,-1.4033703855555557,1.0029279664481927,210.6592415916048,Recommendation Requests,high
televisionsuggestions,Stuck in a psych ward and looking for recommendations,fetidmoppets,32,0.94,40,2025-07-26 13:20:04,https://i.redd.it/ka5zysqty7ff1.jpeg,,,1m9t6jw,[],0.8,4.0,192.0,1.2121212121212122,9.883574058888888,0.9796197632519884,207.2869945443818,Recommendation Requests,high
MovieSuggestions,Romantic movies that don't appear on a top 100 list but aren't Hallmark,JMJimmy,11,1.0,40,2025-07-26 23:14:33,https://www.reddit.com/r/MovieSuggestions/comments/1ma77dc/romantic_movies_that_dont_appear_on_a_top_100/,"We don't want to watch the greatest hits again and Hallmark is off its game this year, so what would be your suggestion for a decent but largely forgotten romance movie?",I'M REQUESTING,1ma77dc,[],0.8,4.0,171.0,3.333333333333333,-0.0244814966666666,1.0000510044187367,188.108721755604,Recommendation Requests,high
televisionsuggestions,Best Documentaries,sunnyc1414,12,0.93,41,2025-07-26 04:41:29,https://www.reddit.com/r/televisionsuggestions/comments/1m9ki3i/best_documentaries/,What are your must watch documentaries? Thanks in advance. ,,1m9ki3i,[],0.8,4.0,176.0,3.1538461538461537,18.526629614444445,0.9621382332521232,186.9363290523737,Recommendation Requests,high
netflix,"""Sandman"" was beautiful",S-T-R-I-D-E-R,37,0.74,23,2025-07-26 04:37:29,https://www.reddit.com/r/netflix/comments/1m9kfgo/sandman_was_beautiful/,"Sandman series was really very appealing  and what a wonderful world building it had... So great use of vfx and amazing acting by the actors... Morpheus was goated and so was Death and all of the siblings and the lore was damn fascinating... I really don't know what went wrong with the series cause it's been cancelled by the Netflix but I really loved the series a lot and it's intricate world building and i really believe it should have gotten more seasons out of it.
Edit: *appealing ",Discussion,1m9kfgo,[],1.2,6.0,175.0,0.6052631578947368,18.59329628111111,0.9620046122214024,185.85080713874544,Reviews & Discussions,high
MovieSuggestions,Suggest me some movies that pushes the boundaries of storytelling.,Suspicious_Clock_133,10,0.86,40,2025-07-26 15:22:54,https://www.reddit.com/r/MovieSuggestions/comments/1m9w0n9/suggest_me_some_movies_that_pushes_the_boundaries/,"Yeah same as title but that movies should be good. most of David lynch movies have pretty unique storytelling. I don't mean only lynchian and this type of fever dream movies. It can be any simple movie but that doesn't something new in wiring and storytelling. And provide  some good and unique type of cinema 
Edit- it just struck me that most of Chris nolan's movie too have pushed boundries of storytelling like memento, inception , Interstellar and the prestige being my favourites ",I'M REQUESTING,1m9w0n9,[],0.8,4.0,170.0,3.636363636363636,7.836351836666667,0.9838068095210376,184.2471576185764,Recommendation Requests,high
MovieSuggestions,Movies like the shining and eyes wide shut,Not-A-BOT-4747,15,0.95,38,2025-07-27 00:34:34,https://www.reddit.com/r/MovieSuggestions/comments/1ma8u7g/movies_like_the_shining_and_eyes_wide_shut/,"If you seen them you would know what i mean , it's not about kubrick 
It's about the sense of something just not being right and everything being in a sort of dream like state 
It's very eerie 
",I'M REQUESTING,1ma8u7g,[],0.8,4.0,167.0,2.375,-1.3580926077777775,1.0028333660150477,184.17317212451292,Recommendation Requests,high
criterion,Criterion Covers and why they help the movies become more appealing.,ThyDisasterpiece,63,0.98,12,2025-07-27 01:07:02,https://www.reddit.com/gallery/1ma9hc9,"Advertisement(in this essay the main advertisement focus is posters), it’s what helps sell a movie. There have been some excellent posters in the past (Rosemary’s Baby, Watership Down, Whatever Happened to Baby Jane?, etc.) and they helped make those films become recognizable; you knew what kind of film you were getting into by the poster alone. So, when Criterion made its debut in the 1980s, they had a whole new competition in their hands, the physical media market was in effect during this time and in order for a company to have well selling physical media, they had to make their covers look pleasing. Criterion was the first of its kind with preserving contemporary, forgotten, and important media; and a lot of people might not be interested in that because in the 80s most people (in their respected countries) want to watch what was new (and hey there were some that had an interest in what Criterion was doing). But as I said, Criterion had to make their covers look unique. So they mad",Discussion,1ma9hc9,[],2.0,10.0,183.0,0.1875,-1.8992037188888888,1.003964512384585,183.72550576637903,Lists & Rankings,high
MovieSuggestions,Timecrimes (2007) is seriously underrated,Few_Diamond7822,77,0.94,22,2025-07-26 11:04:46,https://www.reddit.com/r/MovieSuggestions/comments/1m9qlja/timecrimes_2007_is_seriously_underrated/,"I just watched Timecrimes and it really surprised me. It's a Spanish sci-fi movie about time travel, but not in the usual way. It’s simple, smart, and gets more intense as it goes.

No big effects, just a cool story that messes with your head.

Can’t believe more people don’t talk about it.

Anyone else seen this? Also open to similar suggestions!",I'M SUGGESTING,1m9qlja,[],0.8,4.0,165.0,0.282051282051282,12.138574058888889,0.9750283846407298,177.37968346572043,Recommendation Requests,high
flicks,Action Movie One Hit Wonders,drjudgedredd1,8,0.84,20,2025-07-26 23:28:35,https://www.reddit.com/r/flicks/comments/1ma7hzg/action_movie_one_hit_wonders/,"Rewatching Twister tonight gots me thinking about a world where Helen Hunt becomes an action start, however after Twister it was nothing but dramas

Same with Meryl Streep and the River Wild. Badass river guide is not a role she has played again. 

What other action movie one hit wonders am I missing. ",,1ma7hzg,[],1.5,7.5,158.0,2.2222222222222223,-0.2583703855555555,1.0005384165307478,173.88506981185816,Reviews & Discussions,high
netflix,Korean Dramas Any Recommendations?,JohnIsInTrouble,7,0.71,25,2025-07-26 17:07:22,https://www.reddit.com/r/netflix/comments/1m9yljz/korean_dramas_any_recommendations/,"Hi so just recently I’ve gone on a massive binge on Korean Dramas and have mostly been enjoying myself but I’ve just finished The Frog. I’ve started to notice that Korean shows always start out great then sometimes take a massive nose dive. I’ve watched 8 show, my Name, happiness, Gyeongseong Creatures, #alive, Ballerina, kingdom and all of us are dead. Would love some more recommendations because KDramas are so different to many others I’ve watched. ",Discussion,1m9yljz,[],1.2,6.0,157.0,3.125,6.095240725555556,0.987381866544908,170.71895304755054,Reviews & Discussions,high
truefilm,Interested in making a european movie youtube discussion channel?,Keis1977,3,0.59,15,2025-07-26 10:52:47,https://www.reddit.com/r/TrueFilm/comments/1m9qeab/interested_in_making_a_european_movie_youtube/,"Hello



Would anybody be interested in making a youtube-channel, where we put together a group of people from different european countries to discuss a movie?



I have been making some podcasting and some shorter youtube clips/recommendations for some while now, but all in my native danish language. I got an idea about making a more international channel, because with all the content I cant remember seing one where people got together across borders to discuss a certain movie, and I thought that the idea of getting different perspectives in that way could be interesting. I say european, because that would be the easiest in terms of scheduling, but I am not totally ruling out that it could be broader.



The rough draft as follows:



\- There should be an episode about once a month (we are busy people, lets be honest)



\- We choose a movie to watch and discuss, could be anything from a classic silent movie from the 1920's to some small arthouse production from your own country (no ",,1m9qeab,[],2.0,10.0,153.0,3.75,12.338296281111113,0.974622771457567,164.41728403300775,Lists & Rankings,high
televisionsuggestions,Shows like Stranger Things that are less horror-like?,MnrMevLiefde,6,0.81,35,2025-07-26 08:59:42,https://www.reddit.com/r/televisionsuggestions/comments/1m9onpa/shows_like_stranger_things_that_are_less/,"I loved the storyline and fantasy/Sci fi elements of Stranger Things, but I disliked the gore and horror themes. Are there any fantasy shows that are tamer? I can't do stress inducing violence or suspence right now. ",,1m9onpa,[],0.8,4.0,146.0,5.0,14.223018503333332,0.9708034139029148,156.33729842982555,Recommendation Requests,high
animesuggest,Any binge worthy anime?,Minute_Economist_160,8,0.68,31,2025-07-26 03:10:50,https://www.reddit.com/r/Animesuggest/comments/1m9itk0/any_binge_worthy_anime/,"( bonus question Any popular anime I have missed recently haven't kept up with the most recent anime )

Anything like my hero academia, steins gate or mob psycho 

I'm also Looking for anime to fill the void for cyberpunk edge runners and a certain magical index (also seen all of its spin anime as well) looking for SciFi, horror, and action.

Just wanting new stuff to watch and binge 


Here's my anime list yes I know the ratings are weird Idc about the ratings lol it just a list of stuff I've watched and some of em I forgot to rate anyway


https://myanimelist.net/animelist/Damo_Martin?view=tile&status=7

I liked steins gate, one piece, cyberpunk edge runners, Baccano! my magical index. Also liked mob psycho.

Wanting some new anime to binge I haven't kept up with the newest releases.",What to Watch?,1m9itk0,[],0.8,4.0,132.0,3.4444444444444446,20.037462947777776,0.9591145973960348,139.80312685627658,Recommendation Requests,high
NetflixBestOf,[DISCUSSION] If you..hypothetically had a vpn. What shows/movies that are only on that countries Netflix (say Australian Netflix) would you watch? Again hypothetically ofc..,_-Pochita-_,6,0.59,21,2025-07-26 10:36:53,https://www.reddit.com/r/NetflixBestOf/comments/1m9q4xh/discussion_if_youhypothetically_had_a_vpn_what/,"Any hypothetical recommendations? :) (Australia was just a example not a particular)

Hypothetically remember to provide which country! Not just the name of the show ",,1m9q4xh,[],1.0,5.0,111.0,3.0,12.60329628111111,0.9740848469723928,119.2234180139356,Recommendation Requests,high
flicks,What was the first movie to use a post-credits scene?,doknfs,8,0.9,13,2025-07-27 01:12:24,https://www.reddit.com/r/flicks/comments/1ma9l6x/what_was_the_first_movie_to_use_a_postcredits/,I remember the original Airplane had the scene where the old man was still in the cab waiting outside the airport for Robert Hayes' character to come back out. Can anybody think of a movie that pre-dates that one?,,1ma9l6x,[],1.5,7.5,105.5,1.4444444444444444,-1.9886481633333333,1.0041516111663884,116.48799497805398,Reviews & Discussions,high
MovieSuggestions,A military combat film which switches between the characters on both sides of a battle while they're fighting each other during said battle.,gereedf,9,0.81,24,2025-07-26 16:52:34,https://www.reddit.com/r/MovieSuggestions/comments/1m9y89b/a_military_combat_film_which_switches_between_the/,"I really like seeing how both sides try to best the opposing side during a battle, instead of things just being one-sided, it shows how both sides of a conflict are trying hard to win.",I'M REQUESTING,1m9y89b,[],0.8,4.0,105.0,2.4,6.341907392222223,0.9868745923270557,114.12183219434084,Recommendation Requests,high
tipofmytongue,"[TOMT] [Phrase] A phrase that's similar to ""my personal take""",SubTester2023,9,0.84,30,2025-07-26 20:05:32,https://www.reddit.com/r/tipofmytongue/comments/1ma2wmm/tomt_phrase_a_phrase_thats_similar_to_my_personal/,"I'm trying to think of this phrase. It's another way of saying ""my personal take."" Imagine the context being something like making a recipe your own, or even art. Adding your own flair to make it your own.",Solved,1ma2wmm,[],0.6,3.0,99.0,3.0,3.125796281111111,0.9935090820269984,108.25739912067286,Identification & Help,high
criterion,My first properly sized haul to celebrate my HS graduation!,Micro_Pinny_360,44,0.89,6,2025-07-26 20:26:13,https://www.reddit.com/gallery/1ma3e0k,"One of these pickups is not like the others.

1. What is the first movie you plan to watch from your haul and why? Close Up. I've been interested in Iranian New Wave Cinema for a bit, even wanting to create a Steamed Hams meme revolving around it. However, I find it silly to do so having only seen Taste of Cherry.

2. Is there anything from this haul that you have been looking forward to owning for a long time? Hoop Dreams. If it's one of the greatest documentaries of all time, why not?

3. Are any of your purchases blind buys? If so, why did you select them? Black Girl was the closest. I've heard the synopsis, but I don’t know much about director Ousmane Sèmbene or his style. It's a shame cinema from the African continent is underrepresented, and I've heard that Senegal has a particularly active film scene within the continent.

4. What is a Criterion you’re hoping to add to your collection next? Bicycle Thieves. I was planning on getting it as part of this haul, as I do have an Itali",Pickup,1ma3e0k,[],2.0,10.0,104.0,0.1333333333333333,2.7810740588888887,0.9942228480047604,103.39917619249508,Lists & Rankings,high
